Name,Website,Institution,Kategorie,Kurz Beschreibung,Schlagworte,"Themen (aufteilen in Kurz Beschreibung und Schlagworten, danach löschen)","Fachbereich / Material (aufteilen in Kurz Beschreibung und Schlagworten, danach löschen)",Land,Sprache,Software / Modell / Format,Semantic,Lizenz,Open access,Aktuell/gepflegt,Kommentar,Kontakt,Betrifft Konservierung/Restaurierung,Betrifft Denkmalschutz,Responsive,Letzte Aktualisierung
AATA Online,https://www.getty.edu/conservation/publications_resources/aata/index.html,Getty Conservation Institute,Ontologie,<KI-Generiert> AATA Online ist eine kostenlose Forschungsdatenbank mit Abstracts von Literatur zur Bewahrung und Konservierung des materiellen Kulturerbes. Es enthält über 148.000 Einträge und wird jährlich durch regelmäßige Aktualisierungen um etwa 4.000 neue Einträge erweitert.,"<KI-Generiert> Bewahrung, Konservierung, Kulturerbe, Literatur, Abstracts",Literatur,Alle,<KI-Generiert> Vereinigte Staaten,englisch,HTML,-,,X,X,,"Lynda Bunting, Managing Editor Karen Karyadi, Assistant Editor Cameron Trowbridge, Manager, Research Services  Contact: aata@getty.edu ",True,,True,2024-01-01
Abbreviations and Phrases on Printed Images 1500–1900,https://www.delineavit.nl/stijnmans-terms-in-print-addresses/,Ad Stijnman,<KI-Generiert> Fachtext,"<KI-Generiert> Eine Liste von Abkürzungen und Phrasen auf gedruckten Bildern von 1500 bis 1900. Objekte, Drucke","<KI-Generiert> Objekte, Drucke, Abkürzungen, Phrasen, gedruckte Bilder",Objekte,Drucke,,englisch,PDF,-,,X,-,"NW: Hilfreich, inkl. Abbildungen. Besonders interessant für Objektgeschichte, Historische Techniken. Geht über einfache Liste von Definitionen hinaus =weißt semantische Dimensionen auf","Ad Stijnman, tulip88x@xs4all.nl​.​",True,,True,2017-12-15
"ABCD ""extension for geosciences"" (EFG)",https://github.com/tdwg/efg,Biodoversity Information Standards TDWG,<KI-Generiert> Datenschema,"<KI-Generiert> Die ABCD Extension EFG (Extension for Geoscience) ist eine Reihe von Begriffen, die zur Darstellung von Objekten geowissenschaftlicher Sammlungen entwickelt wurden. Sie erweitert das ABCD-Schema, um geologische Daten zu integrieren, einschliesslich Informationen über paläontologische und geologische Sammlungsobjekte. Schlagworte: Biologische Objekte, Fossilien, Gesteine und Mineralien, Geowissenschaftliche Sammlungen","<KI-Generiert> Biologische Objekte, Fossilien, Gesteine und Mineralien, Geowissenschaftliche Sammlungen","Biologische Objekte, Fossilien, Gesteine und Mineralien",Geowissenschaftliche Sammlungen,DE,englisch,xsd,,,x,,,https://github.com/stanblum,,True,True,2020-06-08
ADeX - Archäologischer DateneXport,https://www.landesarchaeologien.de/kommissionen/archaeologie-und-informationssysteme/projekte-8,VLA,Datenschema,"<KI-Generiert> minimales Datenaustauschformat mit essentiellen Attributen archäologischer Fundstellen (Lokalisierung, Datierung, Befundansprache)",<KI-Generiert> Denkmäler/Flächen,"minimales Datenaustauschformat mit essentiellen Attributen archäologischer Fundstellen (Lokalisierung, Datierung, Befundansprache)",Denkmäler/Flächen,DE,deutsch,CSV+GIS (shp oder mfd),,,<KI-Generiert> x,,unter Berücksichtigung von CIDOC-CRM und INSPIRE-konform,"Kommission der Landesarchäologen, Speziell: Modellierungsgruppe",,True,True,2025-01-01
AIC Lexicon Terms,https://www.conservation-wiki.com/wiki/Lexicon,American Institute for Conservation,Vokabular,"<KI-Generiert> Das Lexicon ist ein illustriertes Glossar von Begriffen zu Zustand und Konservierungsprozessen, das sich an die breite Öffentlichkeit richtet. Der Schwerpunkt des Lexikons liegt auf Begriffen, die bei der Untersuchung von Kunstwerken und Artefakten verwendet werden, sowie auf Begriffen, die zur Beschreibung von Konservierungsprozessen verwendet werden.","<KI-Generiert> Maßnahmen, Methoden, Zustand","Maßnahmen, Methoden, Zustand",Alle,,englisch,MediaWiki,X,,X,X,"KF: Nicht vollständig, aber für uns sehr hilfreich. Austausch/Verknüpfung mit AIC könnte sinnvoll sein ",AIC Bonnie Naugle (Communications & Membership Director) bnaugle@culturalheritage.org,True,,True,2025-01-31
AIC Wiki,https://www.conservation-wiki.com/wiki/Main_Page,American Institute for Conservation,Fachtext,"<KI-Generiert> Das AIC Wiki ist eine von dem American Institute for Conservation gesponserte Ressource, die von verschiedenen AIC-Fachgruppen, Netzwerken und Ausschüssen erstellt wurde. Es enthält Fachwissen über Materialien und Techniken zur Konservierung und Behandlung von Kunstwerken und historischen Artefakten. Schlagwörter: Maßnahmen, Methoden, Zustand.","<KI-Generiert> Konservierung, Behandlung, Kunstwerke, historische Artefakte, Materialien, Techniken, Kulturerbe","Maßnahmen, Methoden, Zustand",Alle,,englisch,MediaWiki,X,,X,X,"KF: Nicht vollständig, aber für uns sehr hilfreich. Austausch/Verknüpfung mit AIC könnte sinnvoll sein ",AIC Bonnie Naugle (Communications & Membership Director) bnaugle@culturalheritage.org,True,,True,2024-12-16
"Analysis, Protection and Preservation of Medieval Wall Paintings",https://denkmalpflege.niedersachsen.de/themen/restaurierung/raphael-projekt-der-europaeischen-kommission-medieval-wallpaintings-135396.html,Niedersächsisches Landesamt für Denkmalpflege,<KI-Generiert> Fachtext,"<KI-Generiert> Das Raphael-Projekt der Europäischen Kommission (1999-2001) befasste sich mit der Analyse, dem Schutz und der Erhaltung mittelalterlicher Wandmalereien. Es wurden innovative Hilfsmittel, Techniken und Verfahren zur Erfassung von Schadensprozessen an drei ausgewählten Wandmalereiobjekten in Niedersachsen, Dänemark und den Niederlanden eingesetzt.","<KI-Generiert> Wandmalereien, Denkmalpflege, Restaurierung, Schutz, Analyse, Mittelalter, Zustand, Wand und Stein",Zustand,Wand und Stein,<KI-Generiert> Deutschland,"deutsch, englisch",PDF,X,,X,-,"NW: Hilfreich, inkl. Abbildungen. Besonders interessant für Objektgeschichte, Historische Techniken",Abteilungsleitung Baudenkmalpflege Dipl.-Ing. Niels Juister Tel: 05 11 / 9 25 - 52 78 niels.juister@nld.niedersachsen.de  Abteilungsleitung Informationsdienste Dr. Katharina Eck Tel: 05 11 / 9 25 - 53 92 katharina.eck@nld.niedersachsen.de  Abteilungsleitung Restaurierung Dipl.-Rest. Maja Ossig 0511 / 9 25 - 5211 maja.ossig@nld.niedersachsen.de,True,,True,2019-08-09
Archaeological Objects Thesaurus (FISH),https://collectionstrust.org.uk/resource/archaeological-objects-thesaurus-fish/,Collection Trust,Vokabular,"<KI-Generiert> Der Archaeological Objects Thesaurus wurde ursprünglich von MDA (jetzt Collections Trust) entwickelt und vom Forum on Information Standards in Heritage (FISH) weiterentwickelt. Er enthält Begriffe für physische Beweise, meist beweglich, die aus vergangenen menschlichen Aktivitäten resultieren, oder Umweltüberreste, die aus archäologischen Feldarbeiten gewonnen werden können. Schlagwörter: Objekte, Archäologie","<KI-Generiert> Objekte, Archäologie",Objekte,Archäologie,,englisch,SPARQL,X,,X,X,"KF: nur Begriffe, keine Erklärungen. Für Restaurierung eher wenig informativ",terminologies@HistoricEngland.org.uk,True,,True,2015-12-15
Archaeological Science Thesaurus (FISH),https://collectionstrust.org.uk/resource/archaeological-sciences-thesaurus-fish/,Collection Trust,Vokabular,"<KI-Generiert> Der FISH Thesaurus für archäologische Wissenschaften wird für die Erfassung der Techniken, Bergungsmethoden und Materialien im Zusammenhang mit den archäologischen Wissenschaften verwendet. Schlagwörter: Methoden, Maßnahmen, Materialien, Archäologie","<KI-Generiert> Methoden, Maßnahmen, Materialien, Archäologie","Methoden, Maßnahmen, Materialien",Archäologie,,englisch,SPARQL,X,,X,X,"KF: nur Begriffe, keine Erklärungen",terminologies@HistoricEngland.org.uk,True,,True,2015-12-15
Archäologie-Thesauri,https://www.landesarchaeologien.de/kommissionen/archaeologie-und-informationssysteme/projekte-9,VLA,Vokabular,"<KI-Generiert> Zeitstrahl zu arch. Zeitstufen in verschiedenen Regionen Deutschlands, Handreichung für den Vergleich von Datensätzen aus verschiedenen Landesämtern bzw. Bundesländern, Typ-Begriffsliste für Fundstellentypen (für ADeX-Feld TYP_GROB vorgesehen), Datierungs-Begriffsliste für Fundstellendatierungen (für ADeX-Feld DAT_GROB vorgesehen)","<KI-Generiert> Datierungen, Fundstellentypen, Zeitstrahl","Zeitstrahl zu arch. Zeitstufen in verschiedenen Regionen Deutschlands, Handreichung für den Vergleich von Datensätzen aus verschiedenen Landesämtern bzw. Bundesländern, Typ-Begriffsliste für Fundstellentypen (für ADeX-Feld TYP_GROB vorgesehen), Datierungs-Begriffsliste für Fundstellendatierungen (für ADeX-Feld DAT_GROB vorgesehen)","Datierungen, Fundstellentypen",DE,deutsch,PDF,,,<KI-Generiert> x,,Vorbericht zu Zeitstrahl: https://www.landesarchaeologien.de/fileadmin/mediamanager/004-Kommissionen/Archaeologie-und-Informationssysteme/Thesauri/Vokabular-Datenstrukturen_v1.1.pdf ; Zeitstrahl: https://www.landesarchaeologien.de/fileadmin/mediamanager/004-Kommissionen/Archaeologie-und-Informationssysteme/Thesauri/Zeitstrahl_V01.pdf,AG Thesauri des VLA,,True,True,2025-01-01
ARIADNE RI,https://www.ariadne-research-infrastructure.eu/ ,ARIADNE Research Infrastructure,Datenschema,"<KI-Generiert> Online Datenaustauschplattform für Daten zu Fundplätzen, Denkmälern und Objekten, Mappingdienste","<KI-Generiert> Datenaustausch, Daten zu Fundplätzen, Daten zu Denkmälern, Daten zu Objekten, Mappingdienste","Online Datenaustauschplattform für Daten zu Fundplätzen, Denkmälern und Objekten, Mappingdienste",Datenaustausch,diverse,englisch,Cidoc CRM,,<KI-Generiert> Creative Commons Attribution-NonCommercial 4.0 International License CC BY-NC 4.0,<KI-Generiert> x,,"non-profit, FAIR, basiert auf 3 Hauptkomponenten:  what, where, when; What – Getty AAT oder MappingTool zum mappen auf AAT; When – Zeitspanne definiert in PeriodO; Where – latitude & longitude; enger Bezug zu EDM und CARARE",,,True,True,
Art & Architecture Thesaurus,https://docs.google.com/spreadsheets/d/1TrJwPM03GM7HZQfxooG0bMT5CV2LZI7H2N3yQlMpzSU/edit#gid=0,Getty Research Institute,Vokabular,"<KI-Generiert> Referenzthesaurus mit breitem Inhaltsbereich. Viele Begriffe decken auch Bereich der Konservierung/Restaurierung mit ab, aber u.U. nicht vollumfänglich",<KI-Generiert> Thesaurus,"Referenzthesaurus mit breitem Inhaltsbereich. Viele Begriffe decken auch Bereich der Konservierung/Restaurierung mit ab, aber u.U. nicht vollumfänglich",Alle,USA,englisch,Linked Open Data,X,,X,X,Wichtiger Referenzthesaurus für Mapping,vocab@getty.edu,True,,True,2025-04-01
Art & Architecture Thesaurus Deutsch,https://www.aat-deutsch.de/,Getty Research Institute,Vokabular,"<KI-Generiert> Die deutsche Fassung des Art & Architecture Thesaurus (AAT) ermöglicht die Recherche nach Begriffen. In einer ersten Projektphase wurde die Objekt-Facette bearbeitet. Solange ein Begriff noch in der Bearbeitung ist, wird die englische Bezeichnung angezeigt.","<KI-Generiert> Objekte, Techniken","Objekte, Techniken",Alle,<KI-Generiert> Deutschland,"englisch, deutsch",Linked Open Data,X,,X,-,"KF: meisten Begriffe weiterhin in Englisch, nur vereinzelt ins Deutsche übersetzt und Definitionen fehlen","Prof. Monika Hagedorn-Saupe, Projektleitung m.hagedorn(at)smb.spk-berlin.de",True,,True,2014-01-01
Art Glass Terms,https://oceansidecompatible.com/pages/art-glass-terms,Oceanside Glasstile World Headquarters,Vokabular,"<KI-Generiert> Glossar der Fachbegriffe für Kunstglas, Objekte, Techniken, Glas","<KI-Generiert> Objekte, Techniken, Glas","Objekte, Techniken",Glas,,englisch,HTML,-,,X,-,NW: Begriffe mit Erklärung. Für Restaurierung eher wenig informativ,artglass@glasstile.com,True,,True,2025-01-01
Art terms,https://www.moma.org/collection/terms/,Museum of Modern Art,Vokabular,"<KI-Generiert> Objekte, Techniken, Moderne Kunst","<KI-Generiert> Objekte, Techniken, Moderne Kunst","Objekte, Techniken",Moderne Kunst,,englisch,HTML,-,,X,-,NW: Begriffe mit Erklärung. Für Restaurierung eher wenig informativ,moma_publications@moma.org,True,,False,
Artlex - Art Dictionary,https://www.artlex.com/de/,Artlex,Vokabular,"<KI-Generiert> Das Original-Wörterbuch und die Enzyklopädie der Kunst im Internet, gegründet 1998. Erweiterung des Angebots um Künstlerprofile, Kunst-Tutorials, Kaufanleitungen und vieles mehr. Schlagwörter: Objekte, Techniken, Künstler, Moderne Kunst","<KI-Generiert> Objekte, Techniken, Künstler, Moderne Kunst","Objekte, Techniken, Künstler",Moderne Kunst,,"deutsch, englisch, etc.",HTML,-,,X,-,"NW: wird wohl seit 2021 überarbeitet, momentan eher nicht nutzbar",admin@artlex.com,True,,True,2024-10-09
Asian Textile Database,https://cameo.mfa.org/wiki/Category:Asian_Textile_Database,"Museum of fine arts, Boston",Fachtext,"<KI-Generiert> Die Asian Textile Database ist ein digitales Inventar von Textilien, die zur Remontierung ostasiatischer Gemälde und Kalligraphien als Schriftrollen und Schirme im National Museum of Asian Art der Smithsonian Institution in Washington, DC, verwendet werden. Ziel ist die Schaffung einer Open-Access-Datenbank, die im Laufe der Zeit erweitert wird, um die internationale Erforschung asiatischer Textilien zu erleichtern. Die Datenbank enthält grundlegende technische Daten wie Mustertyp und -maße, Webstruktur, Fadenzahl und -drehung sowie hochauflösende Bilder. Stichworte: Materialien, Textil.","<KI-Generiert> Materialien, Textil",Materialien,Textil,,englisch,MediaWiki,-,,X,X,NW: Eher eine Art Inventar. Hilfreich bei Zuordnung/Einordnung von Textilien,"CAMEO: Michele Derrick, Research Scientist, retired, MFA mrderrick@gmail.com   Asian Textiles, senior editors: Andrew Hare, Supervisory Conservator, Eat Asian Painting Conservation Studio, National Museum of Asian Art (harean@si.edu)",True,,True,2024-02-27
Atlas of degradation phenomena in plastics and rubbers,https://www.mdpi.com/2073-4360/14/1/121,Deutsches Bergbau-Museum Bochum,Vokabular,"<KI-Generiert> Ein Fachtext über die Analyse von Materialien und einen visuellen Leitfaden für Abbauphänomene in historischen synthetischen Polymeren als Werkzeuge zur Verfolgung von Alterungsprozessen in industriellen Kulturerbesammlungen. Schlagworte: Polymerabbau, Kunststoffe, Kautschuke, visueller Atlas, Schadensphänomene, Museumsübersicht, Industrieerbe, ATR-FTIR, py-GCMS","<KI-Generiert> Polymerabbau, Kunststoffe, Kautschuke, visueller Atlas, Schadensphänomene, Museumsübersicht, Industrieerbe, ATR-FTIR, py-GCMS","Schadens- und Alterungsphänomene an Kunststoffobjekten. Englische Version. Deutsche Version im Druck (""Arbeitsheften des Brandenburgischen Landesamtes für Denkmalpflege und Archäologischen Landesmuseums"" voraussichtlich 2025)",Kunststoffe,DE,englisch (deutsch),Publikation (noch),,<KI-Generiert> Creative Common CC BY,x,x,,,True,True,True,2021-12-29
AV Artifact Atlas,https://www.avartifactatlas.com/,Stanford Media Preservation Lab,Vokabular,"<KI-Generiert> AV Artifact Atlas, eine Ressource zur Identifizierung von Fehlern und Anomalien in analogen und digitalen Videos. Schlagworte: Zustand, Neue Medien / Video","<KI-Generiert> Abrasion, Analog Audio, Azimuth, Baking, Balanced Cables, Banding, Betamax, Black Levels, Cable, Cassette, Chrominance, Cleaning, Clicks, Clipping, Color, Color lock, Color smearing, Comet Tails, Common Artifacts, Curvature error, DV, DV25, Deck Failure, Deformation, Device Error, Digital, Digital Clicks, Digitization, Dirt, Disc Playback, Discrete Cosine Transform, Dot Crawl, Dropout, Dying Batteries, Edge curl, Editing cut, Electrical Error, Expansion, Extended Play, Film, Flange pack, Flicker, Frequency Loss, Ghosting, Gouging, Head Clog, Hue, Hum, Interference, LP, Levels, Levels Too Hot, Long Play, Luminance, Luminance Blooming, MPEG, Magnetic Tape, Magnetostrictive Action, Media Damage, Media Failure, Mono, Noise, Open Reel Tape, Operator Error, Overs Oxide Out, PAL, Phase, Pitch, Playback Adjustment, Popped strand, Post-echo, Power Supply, Pre-echo, Processing Artifact, Production Error, Pulse, Quilting, RF, Rewinding, Servo, Shrinkage, Skew, Smearing, Speed Fluctuation, Spoking, Station Qualification, Step pack, Stereo, Strobing, Sub-sampling, Synchronization, System Failure, Tape Error, Time Base Corrector, Tracking Error, Transfer Artifact, U-matic, Undersaturation, Video Warble, Waveform, Windowing, Y/C Delay Error, deterioration, flutter, lubrication, sticky, Zustand, Neue Medien, Video",Zustand,Neue Medien / Video,,englisch,GitHub,-,<KI-Generiert> Copyrights,X,-,"NW: Begriffe mit Erklärung. Hilfreich, inkl. Visualisierungen. Problemlösungen/Anleitungen vorhanden",avaa@bavc.org,True,,True,
Basic Formal Ontology (BFO),https://basic-formal-ontology.org/,,Ontologie,"<KI-Generiert> Die Basic Formal Ontology (BFO) ist eine kleine Upper-Level-Ontologie, die zur Unterstützung von Informationsabruf, -analyse und -integration in wissenschaftlichen und anderen Bereichen entwickelt wurde.",<KI-Generiert> Ontologie,,,,,,,,<KI-Generiert> x,,,,,True,True,2020-03-24
Beilstein Handbook of Organic Chemistry - Beilstein German to English and English to German Dictionary,https://web.stanford.edu/group/swain/beilstein/index.html,Stanford University,Vokabular,"<KI-Generiert> Das Beilstein Deutsch-Englisch und Englisch-Deutsch Wörterbuch wurde vom wissenschaftlichen Personal des Beilstein-Instituts zusammengestellt, um die Nutzung der Basic Series und Supplementary Series I bis IV durch diejenigen Handbuchbenutzer zu erleichtern, deren Muttersprache nicht Deutsch ist. Mit insgesamt etwa 2.100 Einträgen enthält es die meisten deutschen Wörter, die im Beilstein-Handbuch vorkommen, sowie gängige Abkürzungen, alphabetisch geordnet mit ihren englischen Äquivalenten. Chemie","<KI-Generiert> Chemie, Beilstein Handbook of Organic Chemistry, Beilstein German to English and English to German Dictionary",Chemie,Alle,,"deutsch, englisch",HTML,-,"<KI-Generiert> Copyright 1990 by Springer-Verlag, Berlin Heidelberg. Reproduced for educational purposes with permission from Springer-Verlag.",X,-,"NW: Nur Begriffe, keine Erklärungen",Grace Baysinger graceb@stanford.edu,True,,True,
Bibliographic Database of the Conservation Information Network,https://bcin.info/vufind/,Canadian Conservation Institute Library,Datenbank,<KI-Generiert> Bibliographic Database of the Conservation Information Network. Literatur,<KI-Generiert> Literatur,Literatur,Alle,,"deutsch, englisch etc.",HTML,-,,X,X,NW: Literatur Datenbank auch für Paper inkl. Beschreibungen. Teilweise Verlinkungen zu Volltexten ,General Support: library@iccrom.org info@bcin.info,True,,True,
Bildindex der Kunst und Architektur,https://www.bildindex.de/,Philipps-Universität Marburg,Datenbank,"<KI-Generiert> Objekte, Kunstgeschichte (Malerei, Architektur, angewandter Kunst, Druckgraphik, Skulptur und Zeichenkunst)","<KI-Generiert> Objekte, Kunstgeschichte, Malerei, Architektur, angewandter Kunst, Druckgraphik, Skulptur, Zeichenkunst",Objekte,"Kunstgeschichte (Malerei, Architektur, angewandter Kunst, Druckgraphik, Skulptur und Zeichenkunst)",,deutsch,HTML,-,,X,X,"NW: Bild- und Datenarchiv. Interessant für Provenienzforschung, Restaurierung",bildarchiv@fotomarburg.de  Redaktionsverantwortung Christoph Glorius M.A. Deutsches Dokumentationszentrum für Kunstgeschichte - Bildarchiv Foto Marburg Biegenstraße 11 35037 Marburg Deutschland Tel. +49 6421 28-22115 Fax +49 6421 28-28931 christoph.glorius@fotomarburg.de,True,,True,2025-04-11
BM Object names Thesaurus,https://collectionstrust.org.uk/resource/materials-thesaurus-british-museum/,"British Museum, London",Vokabular,"<KI-Generiert> Der Materials Thesaurus wurde ursprünglich aus Indexbegriffen zusammengestellt, die aus Computeraufzeichnungen generiert wurden, die anhand von kuratorischen Unterlagen und den Objekten selbst erstellt wurden. Es wird betont, dass die endgültige Auflistung nicht als wissenschaftliches Klassifikationssystem gedacht ist, sondern eine Widerspiegelung der Terminologie ist, sowohl aktuell als auch historisch, die in den kuratorischen Abteilungen des British Museum verwendet wird. Schlagwörter: Objekte, Techniken.","<KI-Generiert> Objekte, Techniken","Objekte, Techniken",Alle,,englisch,HTML,-,,X,-,"NW: Hauptsächlich Begriffe, kaum Erklärungen",info@britishmuseum.org,True,,True,2015-12-15
Boppard Conservation Project,https://boppardconservationproject.wordpress.com/about/a-glossary-of-stained-glass-terms/,Glasgow Museums,Vokabular,"<KI-Generiert> Ein Glossar mit Begriffen zum Thema Glasmalerei, erstellt im Rahmen des Boppard Conservation Project. Schlagwörter: Objekte, Techniken, Glas","<KI-Generiert> Objekte, Techniken, Glas","Objekte, Techniken",Glas,,englisch,WordPress,-,,X,-,"NW: Nicht vollständig, teilweise nur Begriffe ohne Erklärung",info@glasgowlife.org.uk ?,True,,True,2013-04-21
BPG Glossary of Terms,https://www.conservation-wiki.com/wiki/BPG_Glossary_of_Terms,American Institute for Conservation,Vokabular,"<KI-Generiert> Ein Glossar mit Begriffen zum Thema Konservierung von Büchern und Papier, zusammengestellt aus verschiedenen Glossaren des Paper Conservation Wiki.","<KI-Generiert> Glossar, Papierkonservierung, Buchkonservierung, Terminologie, Definitionen, Konservierung, Restaurierung, Papier, Buch","Maßnahmen, Zustand",Papier,,englisch,MediaWiki,X,<KI-Generiert> Copyright 2025. The AIC Wiki is a publication of the American Institute for Conservation (AIC).,X,X,"NW: Sehr hilfreich für uns. Sammlung der unterschiedlichen Glossare aus dem Paper Conservation Wiki. Begriffe mit Erklärungen, Verlinkungen vorhanden",AIC Bonnie Naugle (Communications & Membership Director) bnaugle@culturalheritage.org,True,,True,2025-01-23
"BPG Hinge, Tape, and Adhesive Removal","https://www.conservation-wiki.com/wiki/BPG_Hinge,_Tape,_and_Adhesive_Removal",American Institute for Conservation,Fachtext,"<KI-Generiert> Diese Seite behandelt die Entfernung von sich zersetzenden oder potenziell schädlichen Anbringungen wie Klebeband, Scharniermaterial, Klebstoffrückständen und zugehörigen Flecken mit einer Referenzliste von Klebebändern und Klebstoffen, einer Zeitleiste und einem Glossar. ","<KI-Generiert> Klebebandentfernung, Scharnierentfernung, Klebstoffentfernung, Papierkonservierung, Behandlungstechniken für Papier, Materialien und Behandlung",Materialien,Alle,,englisch,MediaWiki,X,,X,X,"NW: Sehr hilfreich für uns und Restaurierung, zum Teil mit Anweisungen",AIC Bonnie Naugle (Communications & Membership Director) bnaugle@culturalheritage.org,True,,True,2024-02-23
Cameo materials database,https://cameo.mfa.org/wiki/Category:Materials_database,"Museum of fine arts, Boston",Vokabular,"<KI-Generiert> Die MATERIALS-Datenbank enthält chemische, physikalische, visuelle und analytische Informationen zu über 10.000 historischen und zeitgenössischen Materialien, die bei der Herstellung und Konservierung von künstlerischen, architektonischen, archäologischen und anthropologischen Materialien verwendet werden. Schlagworte: Materialien, chemische Informationen, physikalische Informationen, visuelle Informationen, analytische Informationen, historische Materialien, zeitgenössische Materialien, Kunst, Architektur, Archäologie, Anthropologie, Konservierung.","<KI-Generiert> Materialien, chemische Informationen, physikalische Informationen, visuelle Informationen, analytische Informationen, historische Materialien, zeitgenössische Materialien, Kunst, Architektur, Archäologie, Anthropologie, Konservierung",Materialien,Alle,,englisch,MediaWiki,-,,X,X,NW: Sehr hilfreich für uns,"CAMEO: Michele Derrick, Research Scientist, retired, MFA mrderrick@gmail.com",True,,True,2022-10-18
Categories for the Description of Works of Art (CDWA),https://www.getty.edu/research/publications/electronic_publications/cdwa/index.html,Getty Research Institute,Datenschema,<KI-Generiert> Dokumentation,<KI-Generiert> Schlagwörter,Dokumentation,Alle,,englisch,HTML,-,,X,X,NW: Sehr hilfreich für uns,vocab@getty.edu,True,,True,
Cocoda / coli conc,https://coli-conc.gbv.de/de/cocoda/,VZG,<KI-Generiert> Datenbank,"<KI-Generiert> Web-Applikation für Mapping von Klassifikationen, Normdateien und Thesauri","<KI-Generiert> Klassifikationen, Normdateien, Thesauri, Mapping","Web-Applikation für Mapping von Klassifikationen, Normdateien und Thesauri",,DE,"deutsch, englisch",<KI-Generiert> HTML,,,<KI-Generiert> x,,,,,True,True,2020-05-27
Collections Trust,https://collectionstrust.org.uk/,Collections Trust,<KI-Generiert> Fachtext,"<KI-Generiert> Collections Trust hilft Museen bei der Arbeit mit Informationen, die Sammlungen und Publikum verbinden. Objekte, Techniken","<KI-Generiert> Objekte, Techniken","Objekte, Techniken",Alle,,englisch,HTML,-,,X,,,,True,,True,2015-12-15
Color and Space in Cultural Heritage (COSCH),https://www.cosch.info/home.html,Hochschule Mainz / King's College London,Ontologie,<KI-Generiert> Dokumentation,<KI-Generiert> Schlagwörter,Dokumentation,Alle,,englisch,"OWL 2, COSCHKR",X,,X,,,"Action Chair Prof. Dr.-Ing. Frank Boochs Managing Director i3mainz Hochschule Mainz – University of Applied Sciences Mainz, Germany e-mail: frank.boochs@hs-mainz.de",True,,True,
