Materialarchiv,https://materialarchiv.ch/de?type=all,Material Archiv CH,<KI-Generiert> Fachtext,"<KI-Generiert> Materialien, Techniken, Objekte","<KI-Generiert> Materialien, Techniken, Objekte","Materialien, Techniken, Objekte",Alle,,deutsch,HTML,-,,X,,,,True,,True,
Materials Testing Results,https://www.conservation-wiki.com/wiki/Materials_Testing_Results,American Institute for Conservation,<KI-Generiert> Fachtext,"<KI-Generiert> Die Seite „Material Testing Results“ enthält Testprotokolle und -ergebnisse. Die Beiträge werden von Einzelpersonen, Institutionen und Publikationen zusammengetragen. Da sich diese Ressource auf Materialien konzentriert, die getestet wurden, um ihre Sicherheit für die Verwendung mit Sammlungen während der Lagerung, Ausstellung und des Transports zu bestimmen, umfasst sie Materialien wie Stoffe, Platten, Befestigungselemente, Klebstoffe, Bänder, Farben und Dichtungsmittel. Die Mehrheit der in den Ressourcen aufgeführten Ergebnisse sind Oddy-Tests. Es werden jedoch auch andere Methoden, entweder allein oder in Kombination, zur Bewertung von Materialien verwendet, und alle Testmethoden, die zu diesem Zeitpunkt zur Bewertung eines Materials verwendet wurden, sind aufgeführt.","<KI-Generiert> Materialien, Testen, Forschung, Analyse, Präventive Pflege, Konservierung, Materialien und Behandlung ",Materialien,Alle,,englisch,MediaWiki,X,,X,,,,True,,True,2025-01-16
Metadaten-Harmonisierung zu Archäologischen Schutzgebieten,https://www.landesarchaeologien.de/kommissionen/archaeologie-und-informationssysteme/projekte-1,VLA,<KI-Generiert> Fachtext,"<KI-Generiert> Metadaten entsprechend INSPIRE, Empfehlungen für harmonisierten Gebrauch unter Berücksichtigung des Minimalkonsens der VLA-Klausurtagung 2010 in Dresden. Metadaten zu Schutzgebieten/Denkmälern","<KI-Generiert> Metadaten, INSPIRE, Schutzgebiete, Denkmäler","Metadaten entsprechend INSPIRE, Empfehlungen für harmonisierten Gebrauch unter Berücksichtigung des Minimalkonsens der VLA-Klausurtagung 2010 in Dresden",Metadaten zu Schutzgebieten/Denkmälern,DE,deutsch,PDF,,,<KI-Generiert> x,,https://www.landesarchaeologien.de/fileadmin/mediamanager/004-Kommissionen/Archaeologie-und-Informationssysteme/Recht/Metadaten-Harmonisierung_02.pdf,AG Recht des VLA,,True,True,2025-01-01
Monument Damage Information System (MONDIS),https://www.mondis.cz/en/web/portal,Technische Universität Prag,<KI-Generiert> Datenbank,"<KI-Generiert> Ein wissensbasiertes System zur Dokumentation und Analyse von Schäden an Kulturdenkmälern, das die Zusammenarbeit und den Erfahrungsaustausch unterstützt und die Integration bestehender Wissensquellen im Bereich des Schutzes des kulturellen Erbes fördert.","<KI-Generiert> Dokumentation, Zustand, Wand und Stein","Dokumenatation, Zustand",Wand und Stein,<KI-Generiert> Tschechische Republik,englisch,"OWL 2, OpenRDF Sesame triple store",X,<KI-Generiert> LGPL v3,X,,,,True,,True,2014-04-07
Monument Damage Information System (MONDIS),https://www.mondis.cz/en/web/portal,Technische Universität Prag,<KI-Generiert> Datenbank,"<KI-Generiert> MONDIS ist ein Forschungsprojekt, das in Partnerschaft zwischen der Tschechischen Technischen Universität in Prag und dem Institut für theoretische und angewandte Mechanik AS CR entwickelt wurde. Ziel ist die Unterstützung der Zusammenarbeit und des Erfahrungsaustauschs sowie die Verbesserung der Integration bestehender Wissensquellen im Bereich des Schutzes des kulturellen Erbes.","<KI-Generiert> kulturelles Erbe, Denkmalschutz, Schadensdokumentation, Schadensanalyse, Risikomanagement",,,<KI-Generiert> Tschechische Republik,<KI-Generiert> cs,"<KI-Generiert> Web, Mobile App",,<KI-Generiert> LGPL v3,<KI-Generiert> x,,,,True,,True,2014-04-07
Multilingual Bookbinding and Conservation Dictionary,http://digitalcellulose.com/wiki/,Suzy Morgan and Peter Verheyen,<KI-Generiert> Fachtext,"<KI-Generiert> Das Multilingual Bookbinding and Conservation Dictionary ist ein internationales Wörterbuch für Buchbinde- und Restaurierungsbegriffe. Ziel des Projekts ist es, alle bekannten Fachausdrücke zur Buchbinderei und Buchkonservierung in möglichst vielen Sprachen an einem Ort zu vereinen. Es enthält aktuelle und archaische Begriffe, um sowohl praktizierende Restauratoren und Buchbinder als auch Buchhistoriker zu unterstützen. Schlagwörter: Objekte, Maßnahmen, Techniken, Zustand, Papier","<KI-Generiert> Buchbinderei, Buchkonservierung, Terminologie, Übersetzung, Fachbegriffe, Glossar","Objekte, Maßnahmen, Techniken, Zustand",Papier,,"deutsch, englisch, etc.",Semantic MediaWiki,X,<KI-Generiert> Open Data Commons Attribution License,X,,,,True,,True,2021-05-21
Multilingual Glossary for Art Librarians,http://archive.ifla.org/VII/s30/pub/mg1.pdf,International Federation of Library Associations and Institutions,<KI-Generiert> Vokabular,"<KI-Generiert> Objekte, Techniken, Papier","<KI-Generiert> Objekte, Techniken, Papier","Objekte, Techniken",Papier,,"deutsch, englisch, etc.",PDF,-,,X,,,,True,,True,
Museumvokabular,http://www.museumsvokabular.de/,Pro Sammlung e.V.,<KI-Generiert> Vokabular,"<KI-Generiert> Umfangreiches, fachlich gestütztes Vokabular zur Erschließung von Museumsobjekten und zur Zusammenführung digitaler Objektinformationen unterschiedlicher Einrichtungen. Werkzeuge für Museen (Systematiken, Wortlisten, Thesauri). Schlagwörter: Dokumentation, Objekte, Techniken","<KI-Generiert> Dokumentation, Objekte, Techniken","Dokumentation, Objekte, Techniken",Alle,,deutsch,HTML,-,,X,,,,True,,True,2004-02-01
Nomenclature for museum cataloguing,https://page.nomenclature.info/index.app,,<KI-Generiert> Vokabular,"<KI-Generiert> Eine strukturierte und kontrollierte Liste von Begriffen für Objektnamen, die nach einem Klassifikationssystem geordnet ist, das als Grundlage für die Indexierung und Katalogisierung von Sammlungen von von Menschenhand gefertigten Objekten dient. Wird zur Erstellung und Verwaltung von Beschreibungsblättern von Sammlungsobjekten in Museen der Geisteswissenschaften und anderen Einrichtungen verwendet, wobei der Schwerpunkt auf Objekten liegt, die für die nordamerikanische Geschichte relevant sind.","<KI-Generiert> Nomenklatur, Museum, Katalogisierung, Objekte, Sammlungen, Terminologie, Vokabular",,,"<KI-Generiert> Kanada, USA",<KI-Generiert> Französisch,<KI-Generiert> HTML,,,<KI-Generiert> x,,,,True,,True,2018-09-01
Numismatic Description Schema (NUDS),https://nomisma.org/nuds,,<KI-Generiert> Datenschema,"<KI-Generiert> Das Numismatic Description Schema ist ein kodifiziertes XML-Schema, das auf numismatischen Datenbankfeldern basiert, die von Sebastian Heath und Andrew Meadows vorgeschlagen wurden.","<KI-Generiert> Numismatik, Schema, XML, Datenbankfelder, Linked Open Data",,,,,<KI-Generiert> XML,,<KI-Generiert> Creative Commons Attribution 3.0 License,<KI-Generiert> x,,,,,True,True,2012-09-12
OASIS,https://oasis.ac.uk/country/england/index.xhtml?country=england,ADS,<KI-Generiert> Datenbank,<KI-Generiert> Einreichung von Daten aus historischer und archäologischer Feldforschung. Repositorium. Vokabulare/Thesauri,"<KI-Generiert> historische und archäologische Feldforschung, Repositorium, Vokabulare, Thesauri",Einreichung von Daten aus historischer und archäologischer Feldforschung. Repositorium. Vokabulare/Thesauri,,UK,englisch,Web-Service,,,<KI-Generiert> x,x,,https://oasis.ac.uk/contact.xhtml,,True,True,
ObjectID,https://icom.museum/en/resources/standards-guidelines/objectid/ ,ICOM - International Council of Museums,<KI-Generiert> Ontologie,"<KI-Generiert> Bezug auf Einzelobjekte, Identifier für Objekte",<KI-Generiert> Schlagwörter,"Internationaler Standard für Dokumentation und Beschreibung von Objekten → Bezug auf Einzelobjekte, Identifier für Objekte",,diverse,diverse,,,,,,"9  Informationskategorien: Objekttyp, Material/Technik, Maße, Beschriftung/Markierungen, Merkmale, Titel, Thema, Datierung, Hersteller",,,True,False,
Oddy-Test,https://www.smb.museum/museen-einrichtungen/rathgen-forschungslabor/forschung/forschungsergebnisse/der-oddy-test/,Rathgen-Forschungslabor,<KI-Generiert> Fachtext,<KI-Generiert> Übersicht der Proben und Ergebnisse des Oddy-Tests zur Materialverträglichkeit von Ausstellungsmaterialien,<KI-Generiert> Materialien,Materialien,Alle,,"deutsch, englisch",PDF,-,,X,,,,True,,True,1998-01-01
ODPA-3DR,https://ieeexplore.ieee.org/document/7419528,Arts et métiers ParisTech,<KI-Generiert> Fachtext,<KI-Generiert> Wand und Stein,"<KI-Generiert> Dokumenatation, Zustand, Wand, Stein","Dokumenatation, Zustand",Wand und Stein,,englisch,Protégé / Cidoc CRM ,X,,X,,,,True,,False,
Ökumenisches Heiligenlexikon,https://www.heiligenlexikon.de/,Joachim Schäfer,<KI-Generiert> Fachtext,"<KI-Generiert> Umfangreiches Lexikon mit Lebensgeschichten und Legenden von über 10.000 Frauen und Männern aus verschiedenen christlichen Konfessionen, inklusive Abbildungen und Links zu weiteren Ressourcen.","<KI-Generiert> Heilige, Namenstage, Patrone, Ökumenisches Heiligenlexikon, Heiligenlexikon",Objekte,Alle,,deutsch,HTML,-,,X,,,,True,,True,1998-09-14
Ontology of Paintings and Preservation of Art (OPPRA),http://www.20thcpaint.org/oppra-owl/,University of Queensland (eResearch Lab) und Asia Pacific Twentieth Century Conservation Art Research Network,Ontologie,<KI-Generiert> Ontologie zur Beschreibung von konservatorischen Maßnahmen an Gemälden unter Erweiterung bestehender Ontologien (u.A. CIDOC CRM) um fachspezifische Klassen und Properties,<KI-Generiert> Gemälde,Aus einem Forschungsprojekt entstandene Ontologie zur Beschreibung von konservatorischen Maßnahmen an Gemälden unter Erweiterung bestehender Ontologien (u.A. CIDOC CRM) um fachspezifische Klassen und Properties ,Gemälde,AUS,englisch,"Protégé / Cidoc CRM,  OIA-ORE, OreChem ",X,,-,,Website aktuell nicht erreichbar. Arbeitsergebnisse nicht auffindbar,,True,,True,
Open Geospatial Consortium (OGC),https://www.ogc.org/de/,Open Geospatial Consortium,<KI-Generiert> Fachtext,"<KI-Generiert> Interface standards für den Aufbau von Schnittstellen. (zB. GML, WCS, WFS, WMS…)",<KI-Generiert> Schnittstellen,"Interface standards für den Aufbau von Schnittstellen. (zB. GML, WCS, WFS, WMS…)",Schnittstellen,diverse,diverse,,,,,,,,,True,False,
Painting Conservation - Glossary of Terms - Smithsonian Museum Conservation Institute,https://mci.si.edu/painting-conservation-glossary-terms,Smithsonian’s Museum Conservation Institute,<KI-Generiert> Fachtext,"<KI-Generiert> Glossar von Begriffen zur Gemäldekonservierung, das Begriffe wie Abrieb, Acryl, Alkyd, Alla Prima, Bindemittel, Blanchieren, Mischen, Blockieren, Blüte, Körper, Kreiden, Chiaroscuro, Farbe, Craquelure, Kriechen, Reißen, Crocking, Trockner, Trocknungsöle, Effloreszenz, Eitempera-Malerei, Emulsion, Emaillefarben, Füllstoff, Fliegendreck, flüchtiges Pigment, Gesso, Glair, Lasur, Glanz, Schmutz, Grundierung, Dunst, Impasto, Inpainting, Lack, See, Latex, Auslaugen, magere Farbe, Lichtechtheit, Helligkeit, Leinöl, geladen, Glanz, Medium, Mehltau, Testbenzin, Mottling, natürlicher Firnis, Öl, oleoresinös, Deckkraft, opak, Orangenhaut, Übermalung, Farbschicht, Pentimento, Pigment, polare Lösungsmittel, Polymer, Grundierung, Harz, Retusche, Durchhängen, Sättigung, Scumble, Farbton, Glanz, Sinken, Größe, Keilrahmen, Sieb, Kunstharz, Kunstharzlacke, Spannkanten, Tempra, thermoplastisch, duroplastisch, Zähigkeit, Terpentin (Spirituosen), Ultraviolett, Firnis, wasserempfindliches Bindemittel, White Spirit sowie Maßnahmen und Zustand im Bezug auf Gemälde erläutert.","<KI-Generiert> Gemälde, Konservierung, Glossar, Begriffe, Maßnahmen, Zustand","Maßnahmen, Zustand",Gemälde,,englisch,HTML,-,,X,,,,True,,True,
Petra archaeological park weathering and deterioration definitions,https://www.heritageforpeace.org/wp-content/uploads/2013/03/Glossary-Weathering-Deterioration-Definitions-AR-EN.pdf,Petra Archaeological Park,<KI-Generiert> Fachtext,"<KI-Generiert> Definitionen im Kontext von Verwitterung und Verschlechterung im archäologischen Park von Petra, mit Fokus auf Wände und Steine.","<KI-Generiert> Zustand, Wand, Stein, Verwitterung, Verschlechterung, Petra archaeological park",Zustand,Wand und Stein,,englisch,PDF,-,,X,,,,True,,True,
Photographic process terms glossary,https://peib.dmu.ac.uk/about/glossary.php,National Gallery of Canada,<KI-Generiert> Fachtext,"<KI-Generiert> Glossar fotografischer Begriffe, das verschiedene fotografische Verfahren und Techniken beschreibt. Enthält Definitionen von Begriffen wie Albumen, Kalotypie, Kollodium und anderen historischen fotografischen Prozessen. Schlagwörter: Objekte, Techniken, Neue Medien, Photographien","<KI-Generiert> Albumen, Kalotypie, Kollodium, fotografische Prozesse, fotografische Techniken, Negative, Positive, Daguerreotype, Cyanotype, Wachspapier, Fotogravüre, Lichtdruck, Objekte, Techniken, Neue Medien, Photographien","Objekte, Techniken",Neue Medien / Photographien,,englisch,HTML,-,,X,,,,True,,True,2004-01-01
PMG Cased Photographs,https://www.conservation-wiki.com/index.php?title=PMG_Cased_Photographs#2.6_Glossary,American Institute for Conservation,<KI-Generiert> Fachtext,"<KI-Generiert> Informationen über Fotografien in Gehäusen, einschließlich Daguerreotypien, Ambrotypien und Tintenbilder. Erläuterungen zu Materialien, Erhaltungsfragen und Behandlungstechniken.","<KI-Generiert> Fotografische Materialien, Objekte, Techniken, Papier","Objekte, Techniken",Papier,,englisch,MediaWiki,-,,X,,,,True,,True,2024-04-11
Polygnosis thesaurus,http://politeia.iesl.forth.gr/polygnosis/,"Department of Conservation of Antiquities and Works of Art, Athens",<KI-Generiert> Vokabular,<KI-Generiert> Methoden,"<KI-Generiert> Methoden, Schlagwörter, Kurzbeschreibung",Methoden,Alle,,englisch,Cidoc CRM,X,,X,,,,True,,True,
Post Production Glossary,https://www.digitalrebellion.com/webapps/glossary,"Digital Rebellion LLC, Los Angeles",<KI-Generiert> Fachtext,"<KI-Generiert> Glossar mit Begriffen aus der Postproduktion. Objekte, Techniken, Neue Medien / Video","<KI-Generiert> Postproduktion, Objekte, Techniken, Neue Medien, Video, Glossar","Objekte, Techniken",Neue Medien / Video,,englisch,HTML,-,,X,,,,True,,True,2025-01-01
"Preparation, Art Handling, Collection Care Information Network",https://www.paccin.org/content.php?1-home,T. Ashley McGrew,<KI-Generiert> Fachtext,"<KI-Generiert> PACCIN ist eine Organisation, die von Hands-On Collections Care Professionals gegründet wurde und sich der Unterstützung ihrer Arbeit verschrieben hat. Die Mitglieder kommen aus den Bereichen Archiv, Kunsttransport, Kofferherstellung, Sammlungspflege, Konservierung usw.","<KI-Generiert> Art/Object Handling, Casework/Fabrication, Conservation, Crating, Fasteners/Hardware, Installation, Lighting, Materials, Packing, Project Management, Registration, Resources, Rigging, Security, Shipping, Space Preparation, Storage, Technology, Tools/Equipment","Maßnahmen, Materialien",Alle,,englisch ,HTML,-,<KI-Generiert> All rights to the material published here are retained by the contributors.,X,,,,True,,True,2025-01-01
Propylaeum@heiDATA,https://www.propylaeum.de/publizieren/forschungsdaten,Propylaeum - Fachinformationsdienst für die Altertumswissenschaften der UB Heidelberg und BSB München,<KI-Generiert> Datenbank,<KI-Generiert> Forschungsdatenreporsitorium der Uni Heidelberg,<KI-Generiert> Forschungsdaten,Forschungsdatenreporsitorium der Uni Heidelberg,,,"<KI-Generiert> Deutsch, Englisch",,,,<KI-Generiert> x,,    • alle Forschungdaten werden mit DOI versehen     • Langzeitarchiv heiARCHIVE     • OAIS-kompatibel     • Mitglied NFDI4Objects TA5,,,True,True,2024-11-20
Raman Spectroscopic Library,http://www.chem.ucl.ac.uk/resources/raman/index.html,University College London,<KI-Generiert> Datenbank,"<KI-Generiert> Raman Spectroscopic Library of Natural and Synthetic Pigments. Raman spectra of sixty-four common pigments, both natural and synthetic, known to have been in use before ~1850 AD, have been studied by Raman microscopy. Spectroscopic files in SPC format may be downloaded via the spectra pages.","<KI-Generiert> Methoden, Pigmente, Raman spectroscopy",Methoden,Pigmente,<KI-Generiert> UK,englisch,HTML,-,<KI-Generiert> Copyright © 1999-2010 UCL,X,,,,True,,True,2010-08-09
Rare Books and Manuscripts Section,https://rbms.info/vocabularies/index.shtml,American Library Association,<KI-Generiert> Vokabular,"<KI-Generiert> Standardisiertes Vokabular zum Abrufen von Materialien aus Spezialsammlungen nach Form, Genre oder verschiedenen physischen Merkmalen, die typischerweise für Forscher und Bibliothekare von Spezialsammlungen von Interesse sind, und zur Zuordnung von Materialien zu Einzelpersonen oder Körperschaften. Objekte, Techniken, Papier","<KI-Generiert> Objekte, Techniken, Papier","Objekte, Techniken",Papier,,englisch,MediaWiki,-,,X,,,,True,,True,2018-03-14
Ratgeber zur Archivierung digitaler Daten,https://www.landesarchaeologien.de/kommissionen/archaeologie-und-informationssysteme,VLA,<KI-Generiert> Fachtext,<KI-Generiert> Ratgeber zur Archivierung digitaler Daten.,"<KI-Generiert> Datenarchivierung, Archivierung digitaler Daten",Empfehlungen zur Archivierung digitaler Daten,Datenarchivierung,DE,deutsch,PDF,,,<KI-Generiert> x,,https://www.landesarchaeologien.de/fileadmin/mediamanager/004-Kommissionen/Archaeologie-und-Informationssysteme/Archivierung/Ratgeber_Archivierung_V1.0.pdf ,AG Archivierung des VLA; https://www.landesarchaeologien.de/kommissionen/archaeologie-und-informationssysteme/projekte-3,,True,True,2025-01-01
Research space,https://researchspace.org/,"British Museum, London",<KI-Generiert> Datenbank,"<KI-Generiert> ResearchSpace ist ein flexibles und erweiterbares Informationssystem, das Forschung mit Provenienz aufzeichnet und sowohl für Spezialisten als auch für ein breiteres Publikum zugänglich ist. Fördert die Wissenserhaltung durch Daten, wobei Bedeutungen und Beziehungen unter Verwendung von realen Ontologien wie CIDOC-CRM ausgedrückt werden.","<KI-Generiert> Objekte, Maßnahmen, Techniken, Zustand","Objekte, Maßnahmen, Techniken, Zustand",Alle,,englisch,Cidoc CRM,X,,X,,,,True,,True,2025-01-31
Resource Description Framework (RDF),https://en.wikipedia.org/wiki/Resource_Description_Framework,,<KI-Generiert> Fachtext,<KI-Generiert> Das Resource Description Framework (RDF) ist eine Methode zur Beschreibung und zum Austausch von Graphdaten. Es wurde ursprünglich als Datenmodell für Metadaten vom World Wide Web Consortium (W3C) entworfen.,"<KI-Generiert> Resource Description Framework, RDF, Datenmodell, Metadaten, Graphdaten, Semantic Web, W3C, Turtle, TriG, N-Triples, N-Quads, JSON-LD, Notation3, RDF/XML, RDF/JSON, SPARQL, RDF Schema, OWL, SHACL, Ontologie",,,,<KI-Generiert> Deutsch,"<KI-Generiert> RDF, XML, Turtle, TriG, N-Triples, N-Quads, JSON-LD",,<KI-Generiert> Creative Commons Attribution-ShareAlike 4.0 License,<KI-Generiert> x,,"W3C Standard, https://format.gbv.de/rdf",,True,True,True,2025-03-12
"Romoe Restauratoren Netzwerk - Restaurierung, Kunst, Denkmalpflege",https://www.romoe.com/de/,Anuvito GmbH,<KI-Generiert> Fachtext,"<KI-Generiert> Internationales Informations- und Branchennetzwerk für Restaurierung, Konservierung, Restaurierungsbedarf, Kunst, Denkmalpflege und Denkmalschutz. Bietet ein Verzeichnis von Experten, Fachbereiche, Regionen und Informationen zu Produkten, Bildung, Museen, Terminen und Jobs. Zusätzliche Schlagworte: Literatur, Materialien.","<KI-Generiert> Restaurierung, Konservierung, Restaurierungsbedarf, Kunst, Denkmalpflege, Denkmalschutz, Literatur, Materialien","Literatur, Materialien",Alle,<KI-Generiert> Deutschland,deutsch,HTML,-,,X,,,,True,,True,2024-04-01
RRUFF Database,https://rruff.info/,University of Arizona,<KI-Generiert> Datenbank,"<KI-Generiert> Eine integrierte Datenbank mit Raman-Spektren, Röntgenbeugungs- und chemischen Daten für Mineralien. Bietet einen Standard für Mineralogen, Geowissenschaftler, Gemmologen und die breite Öffentlichkeit für die Identifizierung von Mineralien auf der Erde und für die planetare Exploration. Schlagwörter: Methoden, Mineralien","<KI-Generiert> Raman-Spektren, Röntgenbeugung, chemische Daten, Mineralien, Mineralogen, Geowissenschaftler, Gemmologen",Methoden,Mineralien,,englisch,HTML,-,,X,,,,True,,True,2007-10-01
Rutherford Online – Lexikon der Elemente,https://www.uniterra.de/rutherford/,Universal Terra Ltd.,<KI-Generiert> Fachtext,<KI-Generiert> Das Rutherford Lexikon der Elemente beschreibt detailliert und kategorisiert die Elemente. Es bietet einen kompakten Einblick in die verschiedenen Elementgruppen. Chemie,"<KI-Generiert> Chemie, Elemente, Periodensystem, Alkalimetalle, Übergangsmetalle, Halogene, Edelgase",Chemie,Alle,,deutsch,HTML,-,,X,,,,True,,True,2023-09-19
Salzwiki,https://www.salzwiki.de/index.php/Startseite,"Hornemann-Institut, HAWK Hildesheim",<KI-Generiert> Fachtext,"<KI-Generiert> SalzWiki ist ein redaktionell betreutes Fachportal mit deutschen und englischen Informationen zu Salzen, Schäden durch Salze, und Umgang mit Salzschäden.","<KI-Generiert> Salze, Schäden durch Salze, Umgang mit Salzschäden, Gutachten, Planung von Maßnahmen",Zustand,Alle,<KI-Generiert> Deutschland,"deutsch, englisch",MediaWiki,-,<KI-Generiert> Namensnennung-Nicht-kommerziell-Weitergabe unter gleichen Bedingungen 3.0 Deutschland,X,,,,True,,True,2025-03-28
Selection of Materials for the Storage or Display of Museum Objects (Oddy test),https://britishmuseum.iro.bl.uk/concern/books/102da8e4-8a79-4d94-adec-00226ee8ed60?locale=en,"British Museum, London",<KI-Generiert> Fachtext,"<KI-Generiert> Dieses Buch stellt die gesamte Bandbreite der Tests für Materialien vor, die bei der Konstruktion von Lager- und Ausstellungsbereichen verwendet werden, die im British Museum verwendet werden, und beschreibt Standardverfahren für deren Durchführung. Es wurde erstmals 1996 veröffentlicht, eine neue und vollständig überarbeitete Ausgabe erschien 2004. Die veröffentlichte Datenbank des British Museum mit Materialtestergebnissen enthält die Ergebnisse der 'Oddy'-Tests und pH-Tests, die in den letzten fünf Jahren an Materialien im Museum durchgeführt wurden. Einige Materialien setzen flüchtige Bestandteile (Lösungsmittel, organische Säuren usw.) frei, die in einem geschlossenen Raum Konzentrationen erreichen können, die Objekte beschädigen, Metalle korrodieren oder beispielsweise organisches Material schädigen können. Materialtests werden durchgeführt, um festzustellen, ob Materialien sicher mit Objekten in Vitrinen, Verpackungskisten oder Lagern verwendet werden können. Die neueste Version der Datenbank und ein Begleitdokument, das die Verwendung erläutert, können unten heruntergeladen werden. Durch das Herunterladen der Datenbank stimmen Sie dem im Dokument „Wichtiger Hinweis und Haftungsausschluss“ genannten zu. Bitte beachten Sie, dass der Zugriff auf die Datenbank den Nutzungsbedingungen der British Museum-Website unterliegt. Schlagwörter: Conservation, museum practice, Oddy test, Materialien.","<KI-Generiert> Conservation, museum practice, Oddy test, Materialien",Materialien,Alle,<KI-Generiert> London,englisch,Excel,-,<KI-Generiert> CC BY-NC-SA 4.0 Attribution-NonCommercial-ShareAlike,X,,,,True,,True,2022-06-08
Simple Knowledge Organisation System (SKOS),https://www.w3.org/2004/02/skos/,SKOS Simple Knowledge Organization System,<KI-Generiert> Vokabular,"<KI-Generiert> Standard zur Abbildung von Thesauri, Klassifikationen und anderen Wissensorganisationssystemen","<KI-Generiert> Thesauri, Klassifikationen, Wissensorganisationssysteme","Standard zur Abbildung von Thesauri, Klassifikationen und anderen Wissensorganisationssystemen",,diverse,diverse,<KI-Generiert> RDF,,"<KI-Generiert> Copyright © 1994-2012 W3C ® (MIT, ERCIM, Keio), All Rights Reserved. W3C liability, trademark, document use and software licensing rules apply.",<KI-Generiert> x,,"W3C Standard, Java Variant: JSKOS, https://format.gbv.de/skos",,True,True,True,2012-12-13
Stained Glass Terminology,https://www.stainedglass.org/learning-resources/stained-glass-dictionary,The Stained Glass Association of America,<KI-Generiert> Fachtext,"<KI-Generiert> Nützliche Begriffe in der architektonischen Glaskunstindustrie. Objekte, Techniken, Glas","<KI-Generiert> Objekte, Techniken, Glas","Objekte, Techniken",Glas,,englisch,HTML,-,,X,,,,True,,True,2022-12-26
Stretchers and Strainers: Glossary,https://www.conservation-wiki.com/wiki/Stretchers_and_Strainers:_Glossary,American Institute for Conservation,<KI-Generiert> Fachtext,"<KI-Generiert> Glossar zu Keilrahmen und Rahmen für Gemälde, Definitionen von Fachbegriffen im Zusammenhang mit der Konservierung und Restaurierung von Gemälden, insbesondere im Hinblick auf Keilrahmen und Rahmen. Enthält Begriffe wie Hilfsstütze, Leiste, Wulst, Fase, Gehrungsverbindung, Blindrahmen, Bolzen und viele mehr.","<KI-Generiert> Materialien, Gemälde, Keilrahmen, Rahmen, Glossar, Definitionen, Konservierung, Restaurierung",Materialien,Gemälde,,englisch,MediaWiki,-,,X,,,,True,,True,2021-06-23
Thesaurus For Graphic Materials,https://www.loc.gov/cds/products/product.php?productID=81,Library of Congress,<KI-Generiert> Vokabular,"<KI-Generiert> Der Thesaurus for Graphic Materials enthält die von der Prints and Photographs Division der Library of Congress und Archiven landesweit zusammengestellten und verwendeten Schlagwörter sowie Genre- und physischen Merkmalbegriffe zum Katalogisieren und Suchen von Bild- und Grafikmaterial. Objekte, Techniken, Papier","<KI-Generiert> Objekte, Techniken, Papier","Objekte, Techniken",Papier,<KI-Generiert> USA,englisch,MultiTes,X,,X,,,,True,,True,2015-01-13
